{"manifest_id":"CTX-1","run_id":"RUN-1","attempt_id":"ATT-1","entries":[{"order":0,"source_class":"BASELINE","authority_class":"APPROVED_BASELINE","source_ref":"baselines/BL-1.md","source_version":"1.0.0","content_hash":"sha256:0000000000000000000000000000000000000000000000000000000000000000","estimated_tokens":1200,"redacted":true,"load_reason":"Approved design baseline"}],"total_estimated_tokens":1200,"assembled_at":"2026-08-05T10:00:00Z","content_hash":"sha256:1111111111111111111111111111111111111111111111111111111111111111"}
